"Art der Entzündung","Ursache der Entzündung","Beispiele für Krankheiten, die durch eine bestimmte Art von Entzündung verursacht werden"
Mikrobielle Entzündung,"Bakterien, Pilze, Viren und Protozoen",Abszess; Lungenentzündung; Sepsis; Hämorrhagisches Fieber
Autoimmunbedingte Entzündung,Aberranter Autoimmunangriff durch Autoantikörper und/oder autoreaktive B- und T-Zellen,Typ-1-Diabetes; Multiple Sklerose; Rheumatoide Arthritis; Psoriasis; Systemischer Lupus erythematodes
Allergische Entzündung,"Allergene (z. B. Pollen, Hausstaubmilben, Tierhaare, Pilze, Insektenbisse und -stiche)",Atopische Dermatitis/Ekzem; Heuschnupfen; Asthma; Kontaktdermatitis; Anaphylaxie; Überempfindlichkeitsreaktionen auf Medikamente
Metabolische Entzündung,Übermäßige Anhäufung von Stoffwechselprodukten (z. B. Cholesterinester oder Harnsäure),Atherosklerose; Gicht; Phenylketonurie
Physikalische Entzündung,"Trauma, Verbrennungen oder Strahlung","Posttraumatische Verletzungen; Chemische, elektrische und thermische (Verbrühungen) Verbrennungen; Strahlenverletzungen"
Konstitutive Entzündung,Angeborene Fehler der angeborenen Immunität,Autoinflammatorische Krankheiten wie Familiäres Mittelmeerfieber; Aicardi-Goutieres-Syndrom; NEMO-Mutation-bedingte autoinflammatorische Darm- und Hautkrankheiten